{
  "schema_version": "1.0.0",
  "source": {
    "id": "eval-k8s-admonition",
    "hash": "f561cf9aecc49d33b51e20325e3c4b8c23929a9229eedbad3aa4c466cce3aae5",
    "algorithm": "sha256",
    "vendor": "Kubernetes",
    "product": "Kubernetes docs",
    "version": "1.30",
    "url": "https://example.com/eval",
    "language": "en",
    "format": "html"
  },
  "source_provenance": {
    "id": {
      "method": "read",
      "value": "eval-k8s-admonition",
      "confidence": 1.0
    },
    "hash": {
      "method": "read",
      "value": "f561cf9aecc49d33b51e20325e3c4b8c23929a9229eedbad3aa4c466cce3aae5",
      "confidence": 1.0
    },
    "vendor": {
      "method": "read",
      "value": "Kubernetes",
      "confidence": 1.0
    },
    "product": {
      "method": "read",
      "value": "Kubernetes docs",
      "confidence": 1.0
    },
    "version": {
      "method": "read",
      "value": "1.30",
      "confidence": 1.0
    },
    "url": {
      "method": "read",
      "value": "https://example.com/eval",
      "confidence": 1.0
    },
    "language": {
      "method": "default",
      "value": "en",
      "confidence": 0.0
    },
    "date": {
      "method": "default",
      "value": "2026-09-24",
      "confidence": 0.0
    },
    "format": {
      "method": "read",
      "value": "html",
      "confidence": 1.0
    },
    "edition": {
      "method": "default",
      "value": null,
      "confidence": 0.0
    },
    "isbn": {
      "method": "default",
      "value": null,
      "confidence": 0.0
    },
    "authors": {
      "method": "default",
      "value": [],
      "confidence": 0.0
    },
    "algorithm": {
      "method": "read",
      "value": "sha256",
      "confidence": 1.0
    }
  },
  "sections": [
    {
      "section_path": "/ch01/intro",
      "title": "Intro",
      "blocks": [
        {
          "id": "c1c18fe8a316",
          "type": "warning",
          "content": {
            "text": "admonition-warning: this configuration is unsafe.",
            "severity": "caution"
          },
          "anchor": {
            "page": 1,
            "section_path": "/ch01/intro",
            "bbox": [
              10.0,
              100.0,
              200.0,
              60.0
            ]
          },
          "confidence": 1.0,
          "origin": "native"
        }
      ]
    }
  ]
}
